patch,build,date,section,change_type,previous,now,full_text,patch_major,patch_minor,patch_hotfix
2.5.3,70356,"January 28, 2026",Bug Fixes,single,,,Fixed an issue where the Executioner Monster Affix sound effect played continuously.,2,5,3
2.5.3,70356,"January 28, 2026",Bug Fixes,single,,,Developer’s Note:,2,5,3
2.5.3,70356,"January 28, 2026",Bug Fixes,single,,,This affix will be re-enabled with the release of this patch.,2,5,3
2.5.3,70356,"January 28, 2026",Bug Fixes,single,,,Fixed an issue where certain Silent Chests in Nahantu did not count towards the Season Rank objective Test of Luck.,2,5,3
2.5.3,70356,"January 28, 2026",Bug Fixes,single,,,Fixed an issue where Zagraal in the Dark Citadel didn't drop loot.,2,5,3
2.5.3,70356,"January 28, 2026",Bug Fixes,single,,,Fixed an issue where some Tower bosses had significantly more health than others.,2,5,3
2.5.3,70356,"January 28, 2026",Bug Fixes,single,,,Fixed an issue where an error would occur when trying to view the profile of a leaderboard entry and the player had a private profile.,2,5,3
2.5.3,70356,"January 28, 2026",Bug Fixes,single,,,Fixed an issue where resetting a piece of masterworked gear did not unlock the Recycled Works challenge.,2,5,3
2.5.3,70356,"January 28, 2026",Bug Fixes,single,,,Fixed an issue where the reward for defeating all the Lesser Evils at once was only given to the player who opened the chest in Local Co-op play.,2,5,3
2.5.3,70356,"January 28, 2026",Bug Fixes,single,,,Fixed an issue where other Divine Gifts could stop gaining experience if another Divine Gift was at Rank 5.,2,5,3
2.5.3,70356,"January 28, 2026",Bug Fixes,single,,,Fixed an issue where some cosmetic items would show as locked even though they were unlocked and usable.,2,5,3
2.5.3,70356,"January 28, 2026",Bug Fixes,single,,,Fixed various instances of Placeholder assets in the Wardrobe.,2,5,3
2.5.3,70356,"January 28, 2026",Bug Fixes,single,,,"Various performance, stability, and audio improvements.",2,5,3
2.5.2,70156,"January 12, 2026",Base Game,single,,,The Tower and Leaderboards,2,5,2
2.5.2,70156,"January 12, 2026",Base Game,single,,,General,2,5,2
2.5.2,70156,"January 12, 2026",Base Game,single,,,Tower now unlocks Tiers the same way the Pit does.,2,5,2
2.5.2,70156,"January 12, 2026",Base Game,single,,,Encounters,2,5,2
2.5.2,70156,"January 12, 2026",Base Game,single,,,Monster populations have been tuned to be fair to both ranged and melee builds.,2,5,2
2.5.2,70156,"January 12, 2026",Base Game,single,,,Bosses have been adjusted to remove unwanted behavior such as self healing and invisibility.,2,5,2
2.5.2,70156,"January 12, 2026",Base Game,single,,,Boss health has been lowered to have parity with Pit Bosses.,2,5,2
2.5.2,70156,"January 12, 2026",Base Game,single,,,Pylons,2,5,2
2.5.2,70156,"January 12, 2026",Base Game,single,,,Removed the delay between when a Pylon Cage is destroyed and when a Pylon can be used.,2,5,2
2.5.2,70156,"January 12, 2026",Base Game,single,,,Pylon health has been reduced in an effort to make them less tanky.,2,5,2
2.5.2,70156,"January 12, 2026",Base Game,single,,,Tuned the pylons to be more balanced to avoid unfair rolls of pylon spawn order.,2,5,2
2.5.2,70156,"January 12, 2026",Base Game,single,,,Pylon of Power,2,5,2
2.5.2,70156,"January 12, 2026",Base Game,single,,,Damage from 4[x] to 3[x].,2,5,2
2.5.2,70156,"January 12, 2026",Base Game,single,,,Pylon of Speed,2,5,2
2.5.2,70156,"January 12, 2026",Base Game,single,,,Player gains a chunk of Temporary Attack Speed (+50% Attack Speed).,2,5,2
2.5.2,70156,"January 12, 2026",Base Game,single,,,Player can Knockdown enemies they pass through.,2,5,2
2.5.2,70156,"January 12, 2026",Base Game,single,,,"Pylon of Channeling, Shrine of Channeling",2,5,2
2.5.2,70156,"January 12, 2026",Base Game,single,,,Resource gain per second to support builds that drain resource which don't benefit from Cost Reduction.,2,5,2
2.5.2,70156,"January 12, 2026",Base Game,single,,,Orbs,2,5,2
2.5.2,70156,"January 12, 2026",Base Game,single,,,"Orbs drop immediately when the monster dies, and no longer wait for post-Death effects (Elite affixes like Fire enchanted, certain spiders, etc.)",2,5,2
2.5.2,70156,"January 12, 2026",Base Game,single,,,"If the orb drops close enough to the player, orbs will appear closer to you to avoid backtracking. If you are too far, orbs will drop at the corpse of the enemy that dropped it.",2,5,2
2.5.2,70156,"January 12, 2026",Base Game,single,,,Quality of Life,2,5,2
2.5.2,70156,"January 12, 2026",Base Game,single,,,Dying will never respawn players on the previous floor.,2,5,2
2.5.2,70156,"January 12, 2026",Base Game,single,,,Exit portals now spawn closer to the player at the end of a run.,2,5,2
2.5.2,70156,"January 12, 2026",Game Updates,single,,,Spinning hazards in certain areas in the Vault of the Crucible dungeon have been removed.,2,5,2
2.5.2,70156,"January 12, 2026",Game Updates,single,,,Locked Capstone Dungeons will now show on the map and display a tooltip which describes requirements to unlock.,2,5,2
2.5.2,70156,"January 12, 2026",Game Updates,single,,,Various updates to The Tower.,2,5,2
2.5.2,70156,"January 12, 2026",Game Updates,single,,,Developer’s Note:,2,5,2
2.5.2,70156,"January 12, 2026",Game Updates,single,,,"With the release of the Tower in this patch, we've made a ton of change since we initially had players dive in for the Season 11 PTR. This includes various Quality of Life improvements and bug fixes. The Tower will be releasing as a Beta so please continue to provide feedback! For more details on the Tower, you can read our blog",2,5,2
2.5.2,70156,"January 12, 2026",Game Updates,single,,,here,2,5,2
2.5.2,70156,"January 12, 2026",Game Updates,single,,,.,2,5,2
2.5.2,70156,"January 12, 2026",Game Updates,single,,,"Meteors spawned by the Essence of Hellfire now only deal damage over time, and no longer deal immediate damage or Stun players hit.",2,5,2
2.5.2,70156,"January 12, 2026",Game Updates,single,,,This part of the power will be re-enabled with the release of this patch.,2,5,2
2.5.2,70156,"January 12, 2026",Game Updates,single,,,"When attempting to sanctify items that cannot be sanctified, you’ll now be better informed why it can’t be sanctified.",2,5,2
2.5.2,70156,"January 12, 2026",Expansion,single,,,Paladin,2,5,2
2.5.2,70156,"January 12, 2026",Expansion,single,,,Fixed an issue where Flails couldn’t be enchanted or drop with the following affixes:,2,5,2
2.5.2,70156,"January 12, 2026",Expansion,single,,,Critical Strike Damage,2,5,2
2.5.2,70156,"January 12, 2026",Expansion,single,,,Damage,2,5,2
2.5.2,70156,"January 12, 2026",Expansion,single,,,Bonus Damage over Time,2,5,2
2.5.2,70156,"January 12, 2026",Expansion,single,,,Damage to Vulnerable enemies,2,5,2
2.5.2,70156,"January 12, 2026",Expansion,single,,,Overpower Damage,2,5,2
2.5.2,70156,"January 12, 2026",Expansion,single,,,Lucky Hit to Gain Resource,2,5,2
2.5.2,70156,"January 12, 2026",Expansion,single,,,Fixed an issue where Paladins could become stuck while climbing.,2,5,2
2.5.2,70156,"January 12, 2026",Expansion,single,,,Fixed an issue where Shield Charge could fail to hit enemies who were close to the player.,2,5,2
2.5.2,70156,"January 12, 2026",Expansion,single,,,Fixed an issue where the player would get stuck in place if using Advance assigned to the right mouse button while March of the Stalwart was equipped.,2,5,2
2.5.2,70156,"January 12, 2026",Expansion,single,,,Fixed an issue where the Rite of Mercy upgrade for Holy Light made Paladins untargetable by Spiritborn's Toxic Skin Passive when playing in PvP.,2,5,2
2.5.2,70156,"January 12, 2026",Expansion,single,,,Fixed an issue where Falling Star with the Freefall upgrade and Rally with the Words of Sacrifice upgrade didn't generate resolve when the Aspect of Valiance was equipped.,2,5,2
2.5.2,70156,"January 12, 2026",Expansion,single,,,Fixed an issue where the Aspect of Valiance could not be imprinted on the expected equipment slots.,2,5,2
2.5.2,70156,"January 12, 2026",Expansion,single,,,Fixed an issue where the Strength node next to the Ironclad Rare node in the Castle Paragon Board was magic instead of normal.,2,5,2
2.5.2,70156,"January 12, 2026",Expansion,single,,,Fixed an issue where the Renewal passive was granting healing instead of Fortify.,2,5,2
2.5.2,70156,"January 12, 2026",Expansion,single,,,Fixed an issue where the player could go out of bounds and get stuck when casting Falling Star towards a Fog Wall.,2,5,2
2.5.2,70156,"January 12, 2026",Expansion,single,,,Fixed an issue where the Screen Reader did not read the Paladin Unique Icon on items.,2,5,2
2.5.2,70156,"January 12, 2026",Expansion,single,,,Spiritborn,2,5,2
2.5.2,70156,"January 12, 2026",Expansion,single,,,Fixed an issue where Spiritborn players could not use the Armory until after unlocking Spirt Halls.,2,5,2
2.5.2,70156,"January 12, 2026",Expansion,single,,,"Fixed an issue where the below balance changes to Spiritborn, introduced in Season of Infernal Chaos, were unintentionally reverted.",2,5,2
2.5.2,70156,"January 12, 2026",Skills,single,,,Rampant Crushing Hand,2,5,2
2.5.2,70156,"January 12, 2026",Skills,single,,,"Damage bonus increased from 3% to 5%, up to 40% from 24%.",2,5,2
2.5.2,70156,"January 12, 2026",Skills,single,,,The Devourer,2,5,2
2.5.2,70156,"January 12, 2026",Skills,single,,,Line damage increased from 140% to 200%.,2,5,2
2.5.2,70156,"January 12, 2026",Skills,single,,,Spit damage increased from 40% to 95%.,2,5,2
2.5.2,70156,"January 12, 2026",Skills,single,,,Harmonious Devourer,2,5,2
2.5.2,70156,"January 12, 2026",Skills,single,,,Poison damage bonus increased from 50% to 100%.,2,5,2
2.5.2,70156,"January 12, 2026",Skills,single,,,Key Passive,2,5,2
2.5.2,70156,"January 12, 2026",Skills,single,,,Vital Strikes,2,5,2
2.5.2,70156,"January 12, 2026",Skills,single,,,Vulnerable damage bonus increased from 80% to 100%.,2,5,2
2.5.2,70156,"January 12, 2026",Paragon,single,,,In-Fighter,2,5,2
2.5.2,70156,"January 12, 2026",Paragon,single,,,Damage bonus increased from 15% to 30%.,2,5,2
2.5.2,70156,"January 12, 2026",Paragon,single,,,Viscous Shield,2,5,2
2.5.2,70156,"January 12, 2026",Paragon,single,,,Stacking damage bonus increased from 1% to 2%.,2,5,2
2.5.2,70156,"January 12, 2026",Paragon,single,,,Bitter Medicine,2,5,2
2.5.2,70156,"January 12, 2026",Paragon,single,,,Poison damage bonus increased from 40% to 60%.,2,5,2
2.5.2,70156,"January 12, 2026",Paragon,single,,,Revealing,2,5,2
2.5.2,70156,"January 12, 2026",Paragon,single,,,"Damage bonus increased from 15% to 30%, up to 60% from 30%.",2,5,2
2.5.2,70156,"January 12, 2026",Accessibility,single,,,Fixed an issue where the Screen Reader did not properly read out buttons in the Season Rank menu.,2,5,2
2.5.2,70156,"January 12, 2026",Accessibility,single,,,Dungeons and The Pit,2,5,2
2.5.2,70156,"January 12, 2026",Accessibility,single,,,Fixed an issue where the Hellfire Adherent boss in the Hellish Descent dungeon could leave the boss arena.,2,5,2
2.5.2,70156,"January 12, 2026",Accessibility,single,,,Fixed an issue where quickly leaving boss arenas after entering minor boss arenas in Capstone Dungeons could allow players to circumvent the encounters.,2,5,2
2.5.2,70156,"January 12, 2026",Accessibility,single,,,Fixed an issue where the Leave Dungeon ability could teleport the player back to the first floor of Vault of the Crucible instead of outside the Dungeon.,2,5,2
2.5.2,70156,"January 12, 2026",Accessibility,single,,,Fixed an issue where enemies could endlessly spawn in the second floor of the Enclave of Darkness.,2,5,2
2.5.2,70156,"January 12, 2026",Accessibility,single,,,Fixed an issue where teleporting via the world map to the Hellish Descent dungeon took the player to the wrong location.,2,5,2
2.5.2,70156,"January 12, 2026",Accessibility,single,,,Fixed an issue where the Guardian's Lair Portal in The Pit could spawn in an unreachable location.,2,5,2
2.5.2,70156,"January 12, 2026",Accessibility,single,,,Fixed an issue where Belial could be damaged before he fully spawned in The Pit.,2,5,2
2.5.2,70156,"January 12, 2026",Accessibility,single,,,Gameplay,2,5,2
2.5.2,70156,"January 12, 2026",Accessibility,single,,,Fixed an issue where Druid players could not use the Armory until they unlocked Spirt Boons.,2,5,2
2.5.2,70156,"January 12, 2026",Accessibility,single,,,Fixed an issue where previously earned renown rewards for extra potion charges still applied for some players.,2,5,2
2.5.2,70156,"January 12, 2026",Accessibility,single,,,"Fixed an issue where Elite Monsters with the Soul Drinker Affix could scale indefinitely, becoming extremely large and eventually unkillable. Who knew drinking souls could be so good for bulking?",2,5,2
2.5.2,70156,"January 12, 2026",Accessibility,single,,,Fixed an issue where sometimes mounts would fail to break through barriers when using Spur.,2,5,2
2.5.2,70156,"January 12, 2026",Accessibility,single,,,User Interface and User Experience,2,5,2
2.5.2,70156,"January 12, 2026",Accessibility,single,,,Fixed an issue where Greater Affixes would lose their unique colored text after being upgraded through Masterworking.,2,5,2
2.5.2,70156,"January 12, 2026",Accessibility,single,,,Fixed an issue where the Boss Health Bar would be duplicated after it revived when fighting the Entwined Souls in Enclave of Darkness.,2,5,2
2.5.2,70156,"January 12, 2026",Accessibility,single,,,Fixed an issue where Toughness did not display properly when comparing items.,2,5,2
2.5.2,70156,"January 12, 2026",Accessibility,single,,,Fixed an issue where the visual effect for the Poison Enchanted affix could persist after the damaging effect was complete.,2,5,2
2.5.2,70156,"January 12, 2026",Miscellaneous,single,,,Fixed an issue where players on controller could accidentally re-summon Azmodan when trying to collect loot after defeating him.,2,5,2
2.5.2,70156,"January 12, 2026",Miscellaneous,single,,,"Various stability, performance, UI, and visual improvements.",2,5,2
2.5.1,69864,"December 18, 2025",Base Game,single,,,Updated descriptions and tooltips for Heavenly Sigils so the requirements for sanctifying an item are clearer.,2,5,1
2.5.1,69864,"December 18, 2025",Base Game,single,,,The Season Rank objective for clearing Pit Tier 40 has been changed to now require a Pit Tier 35 clear instead.,2,5,1
2.5.1,69864,"December 18, 2025",Base Game,single,,,Various UI consistency and clarity improvements for Sanctification and Season Rank.,2,5,1
2.5.1,69864,"December 18, 2025",Base Game,single,,,An audio cue has been added to further bring attention to the safe zones in the Vault of the Crucible Capstone Dungeon.,2,5,1
2.5.1,69864,"December 18, 2025",Base Game,single,,,The altar to summon Azmodan has additional info added to the tooltip to better explain the requirements for summoning Azmodan.,2,5,1
2.5.1,69864,"December 18, 2025",Expansion,single,,,Fixed an issue where Paladins could not get a Strength affix from Sanctification.,2,5,1
2.5.1,69864,"December 18, 2025",Expansion,single,,,Fixed an issue where the Extra Damage for Justice Skills Tempering affix didn't apply properly.,2,5,1
2.5.1,69864,"December 18, 2025",Expansion,single,,,Fixed an issue where the damage increase from Judgement Consumption granted by Virtuous Charge didn't properly apply.,2,5,1
2.5.1,69864,"December 18, 2025",Expansion,single,,,Fixed an issue where Arbiter of Justice did not benefit from Reach of the Law when Judgement of Uriel was equipped.,2,5,1
2.5.1,69864,"December 18, 2025",Expansion,single,,,Fixed an issue where the Seraph's Wings upgrade for Arbiter of Justice granted higher than intended movement speed.,2,5,1
2.5.1,69864,"December 18, 2025",Expansion,single,,,Fixed an issue where the Resolve Stacks from the Aspects of Dominance and Valiance could fall off randomly.,2,5,1
2.5.1,69864,"December 18, 2025",Expansion,single,,,"Fixed an issue where the gauge meter for Arbiter of Justice could stop draining, even though the buff itself reduced properly.",2,5,1
2.5.1,69864,"December 18, 2025",Expansion,single,,,Fixed an issue where Runes for the Paladin could not be randomly crafted at the Jeweler.,2,5,1
2.5.1,69864,"December 18, 2025",Expansion,single,,,Fixed an issue where the initial questline to go through Kurast Undercity couldn't be completed for players in the eternal realm.,2,5,1
2.5.1,69864,"December 18, 2025",Expansion,single,,,"Fixed an issue where the Paladin quest,",2,5,1
2.5.1,69864,"December 18, 2025",Expansion,single,,,Call of the Paladin,2,5,1
2.5.1,69864,"December 18, 2025",Expansion,single,,,could have progression blocked if the associated monsters were slain by nearby NPCs.,2,5,1
2.5.1,69864,"December 18, 2025",Expansion,single,,,Fixed an issue where the Herald of Hatred pet would often turn unstoppable and run away from the player.,2,5,1
2.5.1,69864,"December 18, 2025",Expansion,single,,,Fixed an issue where the objective to Speak to Sihek during the,2,5,1
2.5.1,69864,"December 18, 2025",Expansion,single,,,Deeds of a Champion,2,5,1
2.5.1,69864,"December 18, 2025",Expansion,single,,,quest would shift the quest pin location incorrectly.,2,5,1
2.5.1,69864,"December 18, 2025",Expansion,single,,,"Various fixes and improvements to consistency, accuracy, and clarity for tooltips, descriptions, and icons for the Paladin.",2,5,1
2.5.1,69864,"December 18, 2025",Accessibility,single,,,Fixed an issue where the Screen Reader did not read all information in the Ensembles Tab in the Wardrobe.,2,5,1
2.5.1,69864,"December 18, 2025",Accessibility,single,,,Capstone Dungeons,2,5,1
2.5.1,69864,"December 18, 2025",Accessibility,single,,,Fixed an issue where the boss in the Hellish Descent could fully reset if the player entered specific locations in the boss arena.,2,5,1
2.5.1,69864,"December 18, 2025",Accessibility,single,,,Fixed an issue where the player could get stuck between the wall and the barrier in Enclave of Darkness.,2,5,1
2.5.1,69864,"December 18, 2025",Accessibility,single,,,Fixed an issue where the player respawned at the previous floor when dying during the boss encounter in Enclave of Darkness.,2,5,1
2.5.1,69864,"December 18, 2025",Accessibility,single,,,Fixed an issue where Azmodan's demon gate attack could spawn outside the boss arena in Breach of Sin.,2,5,1
2.5.1,69864,"December 18, 2025",Accessibility,single,,,Fixed an issue where monsters could infinitely spawn in Breach of Sin.,2,5,1
2.5.1,69864,"December 18, 2025",Accessibility,single,,,Gameplay,2,5,1
2.5.1,69864,"December 18, 2025",Accessibility,single,,,Fixed an issue where monsters spawned by Animus Carriers also dropped Animus.,2,5,1
2.5.1,69864,"December 18, 2025",Accessibility,single,,,Fixed an issue where Tortured Gifts failed to respawn if Helltide re-appeared in the same region where it was previously.,2,5,1
2.5.1,69864,"December 18, 2025",Accessibility,single,,,Fixed an issue where access to Divine Gifts could be lost when playing in Local Co-Op.,2,5,1
2.5.1,69864,"December 18, 2025",Accessibility,single,,,Fixed an issue where Meteors spawned by the Essence of Hellfire could reflect Thorns damage back onto the player.,2,5,1
2.5.1,69864,"December 18, 2025",Accessibility,single,,,Fixed an issue where the Sanctification Affix for adding quality could malfunction.,2,5,1
2.5.1,69864,"December 18, 2025",Accessibility,single,,,Fixed an issue where Sorcerer's Flame Shield Enchantment would fail to activate if Flame Shield was equipped to the Skill Bar and Orsivane was equipped.,2,5,1
2.5.1,69864,"December 18, 2025",Miscellaneous,single,,,Fixed an issue where the visual and audio effects for the Essence of Squalor Divine Gift persisted in town.,2,5,1
2.5.1,69864,"December 18, 2025",Miscellaneous,single,,,Developer’s Note:,2,5,1
2.5.1,69864,"December 18, 2025",Miscellaneous,single,,,These effects has been disabled entirely.,2,5,1
2.5.1,69864,"December 18, 2025",Miscellaneous,single,,,Fixed an issue where the Spectral Shiver Cosmetic bundle would be missing even if it was properly owned.,2,5,1
2.5.1,69864,"December 18, 2025",Miscellaneous,single,,,"Fixed an issue where the Leaderboard was viewable, despite having no entries there.",2,5,1
2.5.1,69864,"December 18, 2025",Miscellaneous,single,,,Fixed an issue where tempering Legendary Ancestral Armor required more material types than intended.,2,5,1
2.5.1,69864,"December 18, 2025",Miscellaneous,single,,,Fixed an issue where the Resolute Defender Challenge could be unlocked when not playing as a Paladin.,2,5,1
2.5.1,69864,"December 18, 2025",Miscellaneous,single,,,"Various stability, UI, visual, performance, and audio improvements.",2,5,1
2.5.0,69713,"December 11, 2025",Miscellaneous,single,,,Note:,2,5,0
2.5.0,69713,"December 11, 2025",Miscellaneous,single,,,Additional changes made since the PTR’s conclusion are highlighted in,2,5,0
2.5.0,69713,"December 11, 2025",Miscellaneous,single,,,blue,2,5,0
2.5.0,69713,"December 11, 2025",Miscellaneous,single,,,.,2,5,0
2.5.0,69713,"December 11, 2025",Miscellaneous,single,,,Updates from PTR,2,5,0
2.5.0,69713,"December 11, 2025",Miscellaneous,single,,,Sanctification,2,5,0
2.5.0,69713,"December 11, 2025",Miscellaneous,single,,,Upgrading an affix to a Greater Affix can now also occur on non-ancestral items.,2,5,0
2.5.0,69713,"December 11, 2025",Miscellaneous,single,,,Affixes on Ancestral Unique or Mythic Items can no longer be replaced.,2,5,0
2.5.0,69713,"December 11, 2025",Miscellaneous,single,,,Indestructible affix replaced by adding 5-25 Quality ranks.,2,5,0
2.5.0,69713,"December 11, 2025",Miscellaneous,single,,,"To sanctify an item, it only needs to have an item power of 750 or higher in Torment difficulties, rather than being Ancestral.",2,5,0
2.5.0,69713,"December 11, 2025",Miscellaneous,single,,,"Affix ranges have been adjusted across the board. In general, affix values have been increased, and ranges have been narrowed, and some affixes now have a higher maximum.",2,5,0
2.5.0,69713,"December 11, 2025",Miscellaneous,single,,,Additional Legendary powers have been added.,2,5,0
2.5.0,69713,"December 11, 2025",Miscellaneous,single,,,Divine Gifts,2,5,0
2.5.0,69713,"December 11, 2025",Miscellaneous,single,,,Andariel,2,5,0
2.5.0,69713,"December 11, 2025",Miscellaneous,single,,,Reduced item quality rewards in pre-Torment difficulties.,2,5,0
2.5.0,69713,"December 11, 2025",Miscellaneous,single,,,Duriel,2,5,0
2.5.0,69713,"December 11, 2025",Miscellaneous,single,,,Bonus experience from the maggots in Helltide has been adjusted.,2,5,0
2.5.0,69713,"December 11, 2025",Miscellaneous,single,,,Glyph Upgrades,2,5,0
2.5.0,69713,"December 11, 2025",Miscellaneous,single,,,"Glyph Upgrades now get a scaling chance to grant an extra upgrade attempt based on Divine Gift rank. Rank 1 grants a 25% chance, up to a 100% upgrade chance at Rank 5.",2,5,0
2.5.0,69713,"December 11, 2025",Miscellaneous,single,,,Purified Gifts now grant 2 levels instead of one.,2,5,0
2.5.0,69713,"December 11, 2025",Miscellaneous,single,,,Lesser Evil Invasion,2,5,0
2.5.0,69713,"December 11, 2025",Miscellaneous,single,,,Andariel no longer regenerates Health if you die.,2,5,0
2.5.0,69713,"December 11, 2025",Miscellaneous,single,,,Andariel's phase transition is now much quicker.,2,5,0
2.5.0,69713,"December 11, 2025",Miscellaneous,single,,,The size of Belial's eyeballs has been increased to make them easier to target.,2,5,0
2.5.0,69713,"December 11, 2025",Miscellaneous,single,,,Belial's death now takes less time to finish.,2,5,0
2.5.0,69713,"December 11, 2025",Miscellaneous,single,,,Shrines no longer disappear when fighting Azmodan.,2,5,0
2.5.0,69713,"December 11, 2025",Miscellaneous,single,,,Azmodan has been granted resilience to bring him more in line with other World Bosses.,2,5,0
2.5.0,69713,"December 11, 2025",Miscellaneous,single,,,Lesser Evil events in the Overworld now reward unique items from Lair Boss reward pools.,2,5,0
2.5.0,69713,"December 11, 2025",Balance Update,single,,,Mythic Unique Items,2,5,0
2.5.0,69713,"December 11, 2025",Balance Update,single,,,"Ahavarion, Spear of Lycander",2,5,0
2.5.0,69713,"December 11, 2025",Balance Update,single,,,Lucky Hit gain resource reduced from 66% to 22%.,2,5,0
2.5.0,69713,"December 11, 2025",Balance Update,single,,,Melted Heart of Selig,2,5,0
2.5.0,69713,"December 11, 2025",Balance Update,single,,,Primary resource generation reduced to 50%.,2,5,0
2.5.0,69713,"December 11, 2025",Balance Update,comparison,"Previous (PTR): Each point in your Primary Stat increases your Primary Resource by 3% but you have 75% reduced life. Any damage you would take is dealt to your Primary Resource before your life. If you have not taken damage in 6 seconds, your Resource regenerates to full over 3 seconds.",Damage is dealt to your Primary Resource before Life and damage taken this way is drastically reduced. Your Primary Resource is doubled but Maximum Life is reduced by 75%.,"Changed from Previous (PTR): Each point in your Primary Stat increases your Primary Resource by 3% but you have 75% reduced life. Any damage you would take is dealt to your Primary Resource before your life. If you have not taken damage in 6 seconds, your Resource regenerates to full over 3 seconds. to Damage is dealt to your Primary Resource before Life and damage taken this way is drastically reduced. Your Primary Resource is doubled but Maximum Life is reduced by 75%.",2,5,0
2.5.0,69713,"December 11, 2025",Balance Update,single,,,Developer’s Note:,2,5,0
2.5.0,69713,"December 11, 2025",Balance Update,single,,,"To reduce the number of required caps in the game, we adjusted this effect. This now grants less Primary Resource, but should provide roughly as much durability as before.",2,5,0
2.5.0,69713,"December 11, 2025",Balance Update,single,,,Barbarian,2,5,0
2.5.0,69713,"December 11, 2025",Balance Update,single,,,Damage per 10 points of Strength increased from 1% to 1.1%.,2,5,0
2.5.0,69713,"December 11, 2025",Skills,single,,,Kick,2,5,0
2.5.0,69713,"December 11, 2025",Skills,single,,,Width of the hitbox has been doubled.,2,5,0
2.5.0,69713,"December 11, 2025",Skills,single,,,Power Kick,2,5,0
