patch,build,date,section,change_type,previous,now,full_text,patch_major,patch_minor,patch_hotfix
2.5.0,69713,"December 11, 2025",Miscellaneous,single,,,"Cooldown Reduction can now naturally appear on rings, gloves, and shields.",2,5,0
2.5.0,69713,"December 11, 2025",Miscellaneous,single,,,Various tuning to Capstone Dungeon encounters.,2,5,0
2.5.0,69713,"December 11, 2025",Miscellaneous,single,,,Various monster and monster pack spawning adjustments.,2,5,0
2.5.0,69713,"December 11, 2025",Miscellaneous,single,,,Various other minor updates and tweaks to Sanctification and Seasonal Activities.,2,5,0
2.5.0,69713,"December 11, 2025",Bug Fixes,single,,,Activities,2,5,0
2.5.0,69713,"December 11, 2025",Bug Fixes,single,,,Fixed an issue where Duriel maggots spawned in Helltide spawned experience motes at inappropriate times.,2,5,0
2.5.0,69713,"December 11, 2025",Bug Fixes,single,,,Fixed an issue where the Luminary in Unseen Awakening didn't respawn after the player died.,2,5,0
2.5.0,69713,"December 11, 2025",Bug Fixes,single,,,Fixed an issue where Sweltering Heat in the Torrid Menagerie could cause the player to damage themself.,2,5,0
2.5.0,69713,"December 11, 2025",Bug Fixes,single,,,Fixed an issue where the Leave Dungeon action didn't take the player out of the Dungeon when in the Torrid Menagerie.,2,5,0
2.5.0,69713,"December 11, 2025",Bug Fixes,single,,,Fixed an issue where the Sins of the Many Capstone dungeon could not be exited without logging out.,2,5,0
2.5.0,69713,"December 11, 2025",Bug Fixes,single,,,"Fixed an issue where if you defeated Belial when he appeared after defeating Varshan, he wouldn't drop items as expected.",2,5,0
2.5.0,69713,"December 11, 2025",Bug Fixes,single,,,Fixed an issue where the unavoidable blood orb explosions in the second phase of the Echo of Lilith fight dealt more damage than intended.,2,5,0
2.5.0,69713,"December 11, 2025",Bug Fixes,single,,,Fixed an issue where monsters could stop spawning unexpectedly in Kor Dragan Stronghold.,2,5,0
2.5.0,69713,"December 11, 2025",Bug Fixes,single,,,Fixed an issue where the last enemy could fail to spawn to complete the Enroaching Thickets objective in the Raethwind Wilds.,2,5,0
2.5.0,69713,"December 11, 2025",Bug Fixes,single,,,Fixed an issue where having the objective to defeat the Blood Maiden was impossible to complete due to Duriel replacing the Blood Maiden in Helltide.,2,5,0
2.5.0,69713,"December 11, 2025",Bug Fixes,single,,,Fixed an issue where some bosses could fail to spawn if the player was in stealth when the boss was supposed to spawn.,2,5,0
2.5.0,69713,"December 11, 2025",Bug Fixes,single,,,Fixed an issue where monsters with the Illusory affix could spawn monsters with the Life-Link affix that could then be killed instantly.,2,5,0
2.5.0,69713,"December 11, 2025",Bug Fixes,single,,,Fixed an issue in multiple dungeons where only one instance of animus needed to be collected before the dungeon could be progressed.,2,5,0
2.5.0,69713,"December 11, 2025",Bug Fixes,single,,,Fixed an issue where progression through Escalating Nightmare Dungeons could be blocked by teleport effects.,2,5,0
2.5.0,69713,"December 11, 2025",Bug Fixes,single,,,Fixed an issue where some monsters could deal more damage than expected.,2,5,0
2.5.0,69713,"December 11, 2025",Bug Fixes,single,,,Fixed an issue where some Nightmare Dungeon Affixes could remain active outside of the dungeon.,2,5,0
2.5.0,69713,"December 11, 2025",Bug Fixes,single,,,Skills and Equipment,2,5,0
2.5.0,69713,"December 11, 2025",Bug Fixes,single,,,General,2,5,0
2.5.0,69713,"December 11, 2025",Bug Fixes,single,,,Fixed an issue where the cost for enchanting an item at the Occultist was not consistent for all two-handed weapons.,2,5,0
2.5.0,69713,"December 11, 2025",Bug Fixes,single,,,Fixed an issue where the material cost for Masterworking was displayed inaccurately.,2,5,0
2.5.0,69713,"December 11, 2025",Bug Fixes,single,,,Fixed an issue where the Damage Per Second value was inconsistently displayed between the Masterworking tab and the weapon itself.,2,5,0
2.5.0,69713,"December 11, 2025",Bug Fixes,single,,,Fixed an issue where Items salvaged for far more materials than intended.,2,5,0
2.5.0,69713,"December 11, 2025",Bug Fixes,single,,,Fixed an issue where Soulbrand Unique did not give the correct amount of Barrier.,2,5,0
2.5.0,69713,"December 11, 2025",Bug Fixes,single,,,Fixed an issue where the Feo rune would reset its cooldown when swapping weapons.,2,5,0
2.5.0,69713,"December 11, 2025",Bug Fixes,single,,,Fixed an issue where Attack Speed could appear as an affix on a Two-Handed weapon through enchantment.,2,5,0
2.5.0,69713,"December 11, 2025",Bug Fixes,single,,,Fixed multiple instances of Paragon node bonus effects not being properly being granted.,2,5,0
2.5.0,69713,"December 11, 2025",Bug Fixes,single,,,Fixed multiple instances where items had the incorrect values of elemental resistances.,2,5,0
2.5.0,69713,"December 11, 2025",Bug Fixes,single,,,Fixed an issue where Heavenly Sigils could fail to be consumed when Sanctifying an item.,2,5,0
2.5.0,69713,"December 11, 2025",Bug Fixes,single,,,Barbarian,2,5,0
2.5.0,69713,"December 11, 2025",Bug Fixes,single,,,Fixed an issue where Strategic Rallying Cry did not show the accurate amount of Life gained.,2,5,0
2.5.0,69713,"December 11, 2025",Bug Fixes,single,,,Fixed an issue where Ugly Bastard Helm did not have the appropriate amount of Fire Resistance.,2,5,0
2.5.0,69713,"December 11, 2025",Bug Fixes,single,,,Fixed an issue where the Brash Node no longer granted resistances as a bonus.,2,5,0
2.5.0,69713,"December 11, 2025",Bug Fixes,single,,,Fixed an issue where the Yul rune was not triggered by Ground Stomp if Chainscourged Mail was equipped.,2,5,0
2.5.0,69713,"December 11, 2025",Bug Fixes,single,,,Fixed an issue where Ramaladni's Magnum Opus was active even when the active skill wasn't using the weapon.,2,5,0
2.5.0,69713,"December 11, 2025",Bug Fixes,single,,,Fixed an amount where the Fury cost for Kick was incorrect.,2,5,0
2.5.0,69713,"December 11, 2025",Bug Fixes,single,,,Druid,2,5,0
2.5.0,69713,"December 11, 2025",Bug Fixes,single,,,Fixed an issue where Preserving Earthen Bulwark was granting the incorrect amount of Fortify.,2,5,0
2.5.0,69713,"December 11, 2025",Bug Fixes,single,,,Fixed an issue where Ancestral Fortitude didn't increase non-physical resistance.,2,5,0
2.5.0,69713,"December 11, 2025",Bug Fixes,single,,,Fixed an issue where the Movement Speed buff from Khamsin Steppewalkers could be permanently granted when casting two defensive skills in a row.,2,5,0
2.5.0,69713,"December 11, 2025",Bug Fixes,single,,,Fixed an issue where the description for the buff from Khamsin Steppewalkers displayed the wrong values.,2,5,0
2.5.0,69713,"December 11, 2025",Bug Fixes,single,,,Fixed an issue where the description for Grizzly Rage didn't properly display the damage increase for adding additional skill points.,2,5,0
2.5.0,69713,"December 11, 2025",Bug Fixes,single,,,Necromancer,2,5,0
2.5.0,69713,"December 11, 2025",Bug Fixes,single,,,Fixed an issue where Golems were not properly smaller while in town while using Gravebloom.,2,5,0
2.5.0,69713,"December 11, 2025",Bug Fixes,single,,,Fixed an issue where Rapid Ossification passive was not granting cooldown reduction for more than 100 Essence at a time.,2,5,0
2.5.0,69713,"December 11, 2025",Bug Fixes,single,,,Fixed an issue where Sacrificing Defenders did not provide the bonus Elemental resistances as intended.,2,5,0
2.5.0,69713,"December 11, 2025",Bug Fixes,single,,,Fixed an issue where Paranormal Sever would occasionally fail to apply Vulnerable and Fear.,2,5,0
2.5.0,69713,"December 11, 2025",Bug Fixes,single,,,Rogue,2,5,0
2.5.0,69713,"December 11, 2025",Bug Fixes,single,,,Fixed an issue where the tempering affix for Dance of Knives to deal Double damage could stack to deal incredibly high values.,2,5,0
2.5.0,69713,"December 11, 2025",Bug Fixes,single,,,Sorcerer,2,5,0
2.5.0,69713,"December 11, 2025",Bug Fixes,single,,,Fixed an issue where the Teleport Enchantment tooltip was showing the wrong cooldown.,2,5,0
2.5.0,69713,"December 11, 2025",Bug Fixes,single,,,Fixed an issue where the Oculus could randomly teleport the player while they are healing.,2,5,0
2.5.0,69713,"December 11, 2025",Bug Fixes,single,,,Spiritborn,2,5,0
2.5.0,69713,"December 11, 2025",Bug Fixes,single,,,Fixed an issue where the Antivenom Passive was not functioning.,2,5,0
2.5.0,69713,"December 11, 2025",Bug Fixes,single,,,Fixed an issue where the Jaguar Main Hall would not benefit from Aspect of Unyielding Hits.,2,5,0
2.5.0,69713,"December 11, 2025",Bug Fixes,single,,,Fixed an issue where Ravager would dash to targets uncontrollably when non-Casted core skills were invoked.,2,5,0
2.5.0,69713,"December 11, 2025",Bug Fixes,single,,,"Fixed an issue where the Eagle Primary Spirit Hall's damage was being increased far more than intended by bonuses to Spirit Hall Potency, such as from Wushe Nak Pa.",2,5,0
2.5.0,69713,"December 11, 2025",Bug Fixes,single,,,"Fixed an issue where Mystic Circle would be empowered by skills that were not cast, such as from Path of the Emissary.",2,5,0
2.5.0,69713,"December 11, 2025",Bug Fixes,single,,,Fixed an issue where The Protector did not smash immediately upon landing.,2,5,0
2.5.0,69713,"December 11, 2025",Miscellaneous,single,,,Fixed an issue where Tempering an item would prevent selecting other items that could also apply that affix from being slotted into the tempering window.,2,5,0
2.5.0,69713,"December 11, 2025",Miscellaneous,single,,,Fixed an issue where the World Map could not be viewed while inside a Capstone dungeon.,2,5,0
2.5.0,69713,"December 11, 2025",Miscellaneous,single,,,Fixed an issue where the visual indicatorfor Fortify could be higher than the actual Fortify amount.,2,5,0
2.5.0,69713,"December 11, 2025",Miscellaneous,single,,,Fixed an issue where the quest to Masterwork an item was not completed when Masterworking an item.,2,5,0
2.5.0,69713,"December 11, 2025",Miscellaneous,single,,,"Fixed an issue where abilities could be used and combat was allowed in the Heavenly Forge. (Gentlemen, you can’t fight in here this is the War Room!)",2,5,0
2.5.0,69713,"December 11, 2025",Miscellaneous,single,,,"Fixed an issue where Champions didn't behave like Elites in various contexts, such as not dropping the expected kind of loot.",2,5,0
2.5.0,69713,"December 11, 2025",Miscellaneous,single,,,Fixed an issue where Undercity tributes weren't dropping as expected.,2,5,0
2.5.0,69713,"December 11, 2025",Miscellaneous,single,,,Fixed an issue where sometimes the Undercity could not be accessed when it should be.,2,5,0
2.5.0,69713,"December 11, 2025",Miscellaneous,single,,,Fixed an issue where some bosses granted more experience than intended.,2,5,0
2.5.0,69713,"December 11, 2025",Miscellaneous,single,,,Fixed an issue where Torment could not be unlocked until reaching level 60.,2,5,0
2.5.0,69713,"December 11, 2025",Miscellaneous,single,,,Various miscellaneous fixes to new features and systems introduced in this Season.,2,5,0
2.5.0,69713,"December 11, 2025",Miscellaneous,single,,,"Various stability, UI, and visual improvements.",2,5,0
2.5.0,69713,"December 11, 2025",Miscellaneous,single,,,Vessel of Hatred,2,5,0
2.5.0,69713,"December 11, 2025",Game Updates,single,,,Spiritborn,2,5,0
2.5.0,69713,"December 11, 2025",Game Updates,single,,,New Item,2,5,0
2.5.0,69713,"December 11, 2025",Game Updates,single,,,Path of the Emissary: Unique Boots,2,5,0
2.5.0,69713,"December 11, 2025",Game Updates,single,,,Affixes,2,5,0
2.5.0,69713,"December 11, 2025",Game Updates,single,,,+30% Movement Speed (Inherent),2,5,0
2.5.0,69713,"December 11, 2025",Game Updates,single,,,+16-25% Movement speed,2,5,0
2.5.0,69713,"December 11, 2025",Game Updates,single,,,+155-200% Core Skill damage,2,5,0
2.5.0,69713,"December 11, 2025",Game Updates,single,,,+1-2 Core Skill ranks,2,5,0
2.5.0,69713,"December 11, 2025",Game Updates,single,,,+26.5-40% Impairment Reduction,2,5,0
2.5.0,69713,"December 11, 2025",Game Updates,single,,,Power,2,5,0
2.5.0,69713,"December 11, 2025",Game Updates,single,,,"Every 12-4 meters you move, invoke a Core Skill from your primary Spirit Hall.",2,5,0
2.5.0,69713,"December 11, 2025",Game Updates,single,,,Associated Lair Boss:,2,5,0
2.5.0,69713,"December 11, 2025",Game Updates,single,,,Lord Zir,2,5,0
2.5.0,69713,"December 11, 2025",Skills,single,,,Rushing Claw,2,5,0
2.5.0,69713,"December 11, 2025",Skills,single,,,Damage increased from 80% to 160%.,2,5,0
2.5.0,69713,"December 11, 2025",Skills,single,,,Adaptable Concussive Stomp,2,5,0
2.5.0,69713,"December 11, 2025",Skills,comparison,"When enemies recover from Concussive Stomp, you dodge their next 3 attacks.","When enemies recover from a Concussive Stomp that you Cast, you block their next 3 attacks.","Changed from When enemies recover from Concussive Stomp, you dodge their next 3 attacks. to When enemies recover from a Concussive Stomp that you Cast, you block their next 3 attacks.",2,5,0
2.5.0,69713,"December 11, 2025",Skills,single,,,Now consumes up to 500 Vigor.,2,5,0
2.5.0,69713,"December 11, 2025",Passives,comparison,Hitting enemies with Jaguar Skills increases the Damage they take from you by 0.1-0.3% up to 10-30%.,Gain 2/4/6% Jaguar Skill Attack Speed and Cooldown Reduction.,Changed from Hitting enemies with Jaguar Skills increases the Damage they take from you by 0.1-0.3% up to 10-30%. to Gain 2/4/6% Jaguar Skill Attack Speed and Cooldown Reduction.,2,5,0
2.5.0,69713,"December 11, 2025",Passives,single,,,Unique Items,2,5,0
2.5.0,69713,"December 11, 2025",Passives,single,,,Ring of the Midday Hunt,2,5,0
2.5.0,69713,"December 11, 2025",Passives,comparison,"Your Maximum Vigor is increased by 50%, and killing an enemy grants you 1 - 7 Vigor. While you have Ferocity, your Poisoning effects deal their damage across 33% of the normal duration.","Your Maximum Vigor is increased by 50%, and killing an enemy grants you 1 - 7 Vigor. While you have Ferocity, your new Poisoning effects last 33% longer.","Changed from Your Maximum Vigor is increased by 50%, and killing an enemy grants you 1 - 7 Vigor. While you have Ferocity, your Poisoning effects deal their damage across 33% of the normal duration. to Your Maximum Vigor is increased by 50%, and killing an enemy grants you 1 - 7 Vigor. While you have Ferocity, your new Poisoning effects last 33% longer.",2,5,0
2.5.0,69713,"December 11, 2025",Passives,single,,,Ring of Writhing Moon,2,5,0
2.5.0,69713,"December 11, 2025",Passives,comparison,"A Pestilent Swarm spawns from you every 4 seconds, dealing x Poison damage per hit. Your Pestilent Swarms now orbit around you and generate 3 Vigor per hit.","A Pestilent Swarm spawns from you every 4 seconds, dealing x Poison damage per hit. Your Pestilent Swarms now orbit around you and reduce an equipped Eagle Skill's cooldown by 0.25 seconds per hit.","Changed from A Pestilent Swarm spawns from you every 4 seconds, dealing x Poison damage per hit. Your Pestilent Swarms now orbit around you and generate 3 Vigor per hit. to A Pestilent Swarm spawns from you every 4 seconds, dealing x Poison damage per hit. Your Pestilent Swarms now orbit around you and reduce an equipped Eagle Skill's cooldown by 0.25 seconds per hit.",2,5,0
2.5.0,69713,"December 11, 2025",Passives,single,,,Peacemonger's Signet,2,5,0
2.5.0,69713,"December 11, 2025",Passives,comparison,"While you have at least 4 stacks of Ferocity, you gain 1 - 7 Vigor per second. Gaining Ferocity also grants Resolve.","While you have at least 4 stacks of Ferocity, you gain 5-15%[x] increased damage and Armor. Gaining Ferocity also grants Resolve.","Changed from While you have at least 4 stacks of Ferocity, you gain 1 - 7 Vigor per second. Gaining Ferocity also grants Resolve. to While you have at least 4 stacks of Ferocity, you gain 5-15%[x] increased damage and Armor. Gaining Ferocity also grants Resolve.",2,5,0
2.5.0,69713,"December 11, 2025",Passives,single,,,Band of First Breath,2,5,0
2.5.0,69713,"December 11, 2025",Passives,single,,,Max Life percentage has been replaced with additive Max Life.,2,5,0
2.5.0,69713,"December 11, 2025",Passives,single,,,Critical Strike Chance replaced with Resolve generation rate.,2,5,0
2.5.0,69713,"December 11, 2025",Passives,single,,,Rod of Kepeleke,2,5,0
2.5.0,69713,"December 11, 2025",Passives,single,,,Can now only consume up to 500 Vigor.,2,5,0
2.5.0,69713,"December 11, 2025",Passives,single,,,Harmony of Ebewaka,2,5,0
2.5.0,69713,"December 11, 2025",Passives,single,,,Damage Reduction affix replaced with Dexterity affix.,2,5,0
2.5.0,69713,"December 11, 2025",Passives,single,,,Loyalty's Mantle,2,5,0
2.5.0,69713,"December 11, 2025",Passives,single,,,Wound Drinker,2,5,0
2.5.0,69713,"December 11, 2025",Passives,single,,,Damage Reduction from Poisoned Enemies affix replaced with Armor affix.,2,5,0
2.5.0,69713,"December 11, 2025",Passives,single,,,Jacinth Shell,2,5,0
2.5.0,69713,"December 11, 2025",Passives,single,,,Armor percentage affix replaced with All Resistance affix.,2,5,0
2.5.0,69713,"December 11, 2025",Passives,single,,,Damage Reduction while Injured affix replaced with Dexterity affix.,2,5,0
2.5.0,69713,"December 11, 2025",Passives,single,,,Protection of the Prime,2,5,0
2.5.0,69713,"December 11, 2025",Passives,single,,,Damage Reduction while Standing Still affix replaced with Armor affix.,2,5,0
2.5.0,69713,"December 11, 2025",Passives,single,,,Spirit Hall,2,5,0
2.5.0,69713,"December 11, 2025",Passives,single,,,All,2,5,0
2.5.0,69713,"December 11, 2025",Passives,single,,,All main Spirit Hall potency affixes changed to main Spirit Hall Damage.,2,5,0
2.5.0,69713,"December 11, 2025",Passives,single,,,Updated the tooltips to display the damage that scales with the above affix in blue.,2,5,0
2.5.0,69713,"December 11, 2025",Passives,single,,,Jaguar,2,5,0
2.5.0,69713,"December 11, 2025",Passives,comparison,"Every 15th time you deal direct damage to an enemy with a Jaguar Skill, unleash additional slashes dealing 20% of the damage you have dealt to them in the last 0.5 seconds. All Skills are now also Jaguar Skills.","Every 15th time you deal direct damage with a Jaguar Skill, unleash a Beast Strike for (100% Weapon damage), increasing all damage you deal by 3% and doubling Beast Strike's damage, stacking 5 times. You lose all stacks when you stop attacking for 1 second.","Changed from Every 15th time you deal direct damage to an enemy with a Jaguar Skill, unleash additional slashes dealing 20% of the damage you have dealt to them in the last 0.5 seconds. All Skills are now also Jaguar Skills. to Every 15th time you deal direct damage with a Jaguar Skill, unleash a Beast Strike for (100% Weapon damage), increasing all damage you deal by 3% and doubling Beast Strike's damage, stacking 5 times. You lose all stacks when you stop attacking for 1 second.",2,5,0
2.5.0,69713,"December 11, 2025",Passives,single,,,Eagle,2,5,0
2.5.0,69713,"December 11, 2025",Passives,single,,,Now scales damage rather than Vulnerable duration.,2,5,0
2.5.0,69713,"December 11, 2025",Passives,single,,,Gorilla,2,5,0
2.5.0,69713,"December 11, 2025",Passives,single,,,Now only scales Thorns damage.,2,5,0
2.5.0,69713,"December 11, 2025",Passives,single,,,Barrier per hit reduced from 5% to 2.5%.,2,5,0
2.5.0,69713,"December 11, 2025",Passives,single,,,No longer has a cap of 30% Barrier.,2,5,0
2.5.0,69713,"December 11, 2025",Passives,single,,,Updated the tooltip to clarify that Gorilla skills do not need to be Cast to gain the effect.,2,5,0
2.5.0,69713,"December 11, 2025",Passives,single,,,Centipede,2,5,0
2.5.0,69713,"December 11, 2025",Passives,single,,,Now scales damage rather than Slow and Damage reduction.,2,5,0
2.5.0,69713,"December 11, 2025",Passives,single,,,Damage Reduction per stack increased from 2% to 4%.,2,5,0
2.5.0,69713,"December 11, 2025",Passives,single,,,Increased the debuff duration from 6 to 8 seconds.,2,5,0
2.5.0,69713,"December 11, 2025",Passives,single,,,Increased the total poison amount from 70% to 160%.,2,5,0
2.5.0,69713,"December 11, 2025",Legendary Aspects,single,,,Reactive armor,2,5,0
2.5.0,69713,"December 11, 2025",Legendary Aspects,single,,,Fixed the tooltip to clarify it invokes a free Concussive stomp rather than Casting.,2,5,0
2.5.0,69713,"December 11, 2025",Paragon,single,,,Sapping Legendary Node,2,5,0
2.5.0,69713,"December 11, 2025",Paragon,single,,,Vigor Restoration changed from 15% to 15 Vigor.,2,5,0
2.5.0,69713,"December 11, 2025",Tempering,single,,,Mystic Circle Potency moved from Jaguar Finesse (Offensive) to Plains Augments (Weapon).,2,5,0
2.5.0,69713,"December 11, 2025",Tempering,single,,,Mercenaries,2,5,0
2.5.0,69713,"December 11, 2025",Tempering,single,,,Raheir,2,5,0
2.5.0,69713,"December 11, 2025",Tempering,single,,,Shield Charge,2,5,0
2.5.0,69713,"December 11, 2025",Tempering,single,,,Fortify reduced from 5% to .2% of Maximum Life.,2,5,0
2.5.0,69713,"December 11, 2025",Tempering,single,,,Ground Slam,2,5,0
2.5.0,69713,"December 11, 2025",Tempering,single,,,Required attacks increased from 3 to 20.,2,5,0
2.5.0,69713,"December 11, 2025",Tempering,single,,,Healing increased from 5% to 8% of Maximum Life.,2,5,0
2.5.0,69713,"December 11, 2025",Tempering,single,,,Subo,2,5,0
2.5.0,69713,"December 11, 2025",Tempering,single,,,Seeker perk changed from restoring 50% Maximum Resource to 50 primary resource gained.,2,5,0
2.5.0,69713,"December 11, 2025",Tempering,single,,,Varyana,2,5,0
2.5.0,69713,"December 11, 2025",Tempering,single,,,Taste of Flesh,2,5,0
2.5.0,69713,"December 11, 2025",Tempering,single,,,Healing reduced from 2% to 1% of Maximum Health.,2,5,0
2.5.0,69713,"December 11, 2025",Tempering,single,,,Aldkin,2,5,0
2.5.0,69713,"December 11, 2025",Tempering,single,,,Ember's Gift resource gain changed from 33% of max per second to 33 resource per second.,2,5,0
2.5.0,69713,"December 11, 2025",Tempering,single,,,Kurast Undercity,2,5,0
2.5.0,69713,"December 11, 2025",Tempering,single,,,Tributes,2,5,0
2.5.0,69713,"December 11, 2025",Tempering,single,,,"The Undercity comes bearing gifts, despite Andariel's corruption! Most rewards in the Undercity have been buffed, with a particular focus on ensuring that both rarer and pre-Torment Tributes are more rewarding.",2,5,0
2.5.0,69713,"December 11, 2025",Tempering,single,,,Significantly increased Tribute of Pride's legendary item rewards.,2,5,0
2.5.0,69713,"December 11, 2025",Tempering,single,,,Significantly increased Tribute of Mystique's magic rune rewards.,2,5,0
2.5.0,69713,"December 11, 2025",Tempering,single,,,Increased the quality from Magic to Rare and reduced the drop chance of Tribute of Pride.,2,5,0
2.5.0,69713,"December 11, 2025",Tempering,single,,,Increased the quality from Magic to Rare and reduced the drop chance of Tribute of Mystique.,2,5,0
2.5.0,69713,"December 11, 2025",Tempering,single,,,Significantly increased the potency of Tribute of Growth's experience rewards before Level 60.,2,5,0
2.5.0,69713,"December 11, 2025",Tempering,single,,,Significantly increased Tribute of Refinement's Obducite rewards.,2,5,0
2.5.0,69713,"December 11, 2025",Tempering,single,,,Significantly increased Tribute of Radiance's ancestral legendary rewards.,2,5,0
2.5.0,69713,"December 11, 2025",Tempering,single,,,Buffed item rewards from any Undercity run in Torment difficulty.,2,5,0
2.5.0,69713,"December 11, 2025",Tempering,single,,,Increased the potency of experience orbs that spawn from any Undercity run before level 60.,2,5,0
2.5.0,69713,"December 11, 2025",Tempering,single,,,The chance to find pre-torment Tributes has been reduced.,2,5,0
2.5.0,69713,"December 11, 2025",Skills,single,,,Fixed an issue where the rank 5 Protector Thorns damage bonus was being applied less than intended.,2,5,0
2.5.0,69713,"December 11, 2025",Skills,single,,,Fixed an issue where Touch of Death didn't spawn a swarm if the target was killed by the initial strike damage.,2,5,0
2.5.0,69713,"December 11, 2025",Skills,single,,,Fixed an issue where Poised Touch of Death did not get applied when a Core Skill hit twice.,2,5,0
2.5.0,69713,"December 11, 2025",Paragon,single,,,Fixed an issue where the Convergency Legendary Node didn't scale properly with the Canny Glyph's legendary bonus.,2,5,0
2.5.0,69713,"December 11, 2025",Paragon,single,,,Fixed an issue where the Drive Paragon Node could scale damage higher than intended.,2,5,0
2.5.0,69713,"December 11, 2025",Items,single,,,Fixed an issue where the Unyielding Hits Aspect didn't increase the damage of the Centipede Main Hall effect as expected.,2,5,0
2.5.0,69713,"December 11, 2025",Items,single,,,Fixed an issue where Hesha E Kesungi would display as having one more Greater Affix than it had.,2,5,0
2.5.0,69713,"December 11, 2025",Items,single,,,Fixed an issue where Aspect of Fleet Wings could occasionally not grant Unhindered.,2,5,0
2.5.0,69713,"December 11, 2025",Items,single,,,Fixed an issue where Aspect of Fleet Wings could snapshot the damage buff from Unrestrained Power.,2,5,0
2.5.0,69713,"December 11, 2025",Items,single,,,Fixed an issue where bonus Armor and Thorns gained from the Bruiser's Aspect did not display while in town.,2,5,0
2.5.0,69713,"December 11, 2025",Items,single,,,Runes,2,5,0
2.5.0,69713,"December 11, 2025",Items,single,,,Fixed an issue where Xal Rune would occasionally not properly maintain your current Life percentage when it triggered.,2,5,0
2.5.0,69713,"December 11, 2025",Items,single,,,Fixed an issue where Moni Rune would reset its counter when Weapon Swapping.,2,5,0
2.5.0,69713,"December 11, 2025",Items,single,,,Fixed an issue where Jah rune's Teleport would Teleport you in a random direction while using The Oculus.,2,5,0
2.5.0,69713,"December 11, 2025",Items,single,,,Mercenaries,2,5,0
2.5.0,69713,"December 11, 2025",Items,single,,,Fixed an issue where Subo's Bargaining Chips passive did not properly increase Overpower damage.,2,5,0
2.5.0,69713,"December 11, 2025",Items,single,,,Fixed an issue where Subo's Ambusher Passive did not properly grant bonus Lucky Hit Chance.,2,5,0
